step,claim,status,note
1,MacWilliams/Fourier identity expresses M_C(u) as product cosh times Golay shell tanh polynomial,inherited,checked in prior package
2,Block-RMS domination lemma bounds each shell A_w(tanh |u|) by A_w(1) r^w,conditional,single remaining finite combinatorial lemma
3,h(x)=log cosh(sqrt x) is concave on x>=0,analytic,h prime = tanh y/(2y) decreases
4,g(x)=tanh^2(sqrt x) is concave on x>=0,analytic,g prime = tanh(y) sech^2(y)/y decreases
5,Jensen gives sum log cosh u_i <= 24 log cosh(||u||/sqrt24),analytic,strict unless equal absolute magnitudes
6,Jensen gives mean tanh^2 u_i <= tanh^2(||u||/sqrt24),analytic,strict unless equal absolute magnitudes
7,"Since W(r) is increasing, log M_C(u) <= 24 log cosh(t)+log W(tanh t), t=||u||/sqrt24",conditional,depends only on block-RMS lemma
8,Scalar maximization gives K^2 candidate,numeric-certified,one-dimensional high precision optimization
